dataverse,article,date,year,journal
JOP,How to detect heterogeneity in conjoint experiments,2023-08-10,2023,jop
JOP,Advantage of Backwardness? The Coercive Imbalance Outside Western Europe,2023-08-02,2023,jop
JOP,Rally 'round the barrack: Far-right support and the military,2023-08-02,2023,jop
JOP,Private Participation: How Populists Engage with International Organizations,2023-07-25,2023,jop
JOP,Measuring Political Narratives in African News Media: A Word Embeddings Approach,2023-07-21,2023,jop
JOP,Replication Data for Gender Quota Adoption and the Qualifications of Parliamentarians,2023-07-17,2023,jop
JOP,"Local Politics, Global Consequences: How Structural Imbalance in Domestic Political Networks Affects International Relations,",2023-07-14,2023,jop
JOP,How Do Pocketbook and Distributional Concerns Affect Citizens’ Preferences for Carbon Taxation?,2023-07-12,2023,jop
JOP,"Replication Data for ""News and Public Opinion: Which Comes First?""",2023-07-12,2023,jop
JOP,The Economic Effects of Leaders' Economic Interests: Evidence from Election by Lot in the Florentine Republic,2023-07-10,2023,jop
JOP,Replication Data for Higher Education and Cultural Liberalism,2023-07-05,2023,jop
JOP,Women’s Political Representation in African Rebel Parties,2023-07-05,2023,jop
JOP,Belief in COVID-19 Misinformation in Nigeria,2023-06-24,2023,jop
JOP,"Facing Voters: Gender Expression, Gender Stereotypes, and Vote Choice",2023-06-12,2023,jop
JOP,Parochial Altruism in Civil Society Leaders: Legacies of Contested Governance,2023-06-08,2023,jop
JOP,Out-group Threat and Xenophobic Hate Crimes: Evidence of Local Intergroup Conflict Dynamics between Immigrants and Natives,2023-06-07,2023,jop
JOP,"Replication Data to ""Strategic Communication in Dictatorships: Performance, Patriotism, and Intimidation""",2023-06-02,2023,jop
JOP,Destruction from Above: Long-Term Legacies of the Tokyo Air Raids,2023-06-01,2023,jop
JOP,Military Attitudes on the Chemical Weapons Taboo: Evidence from the Pacific Theater,2023-05-31,2023,jop
JOP,Comparative vote switching,2023-05-25,2023,jop
JOP,“How Distributional Conflict over In-Kind Benefits Generates Support for Far-right Parties,2023-05-24,2023,jop
JOP,Who Do You Trust? Institutions that Constrain Leaders Help People Prevent Disaster,2023-05-24,2023,jop
JOP,Measuring Perceived Skin Color: Spillover Effects and Likert-type Scales,2023-05-24,2023,jop
JOP,"Subsidies for Sale: Post-government Career Concerns, Revolving-door Channels, and Public Resource Misallocation in China",2023-05-18,2023,jop
JOP,Fighting for Peace? The Direct and Indirect Effects of Women’s Participation in Rebel Groups on Peace Negotiations,2023-05-09,2023,jop
JOP,Affluence and Congruence: Unequal Representation Around the World,2023-05-08,2023,jop
JOP,Political Geography and Firm Strategies: How Electoral Competition Influences Local Job Creation,2023-05-08,2023,jop
JOP,Borrowing to Self-Insure? Credit Access and Support for Welfare,2023-05-01,2023,jop
JOP,"Signaling Race, Ethnicity, and Gender with Names: Challenges and Recommendations",2023-04-28,2023,jop
JOP,Does job insecurity shape policy preferences? An experimental manipulation of labor market risk.,2023-04-28,2023,jop
JOP,How to Stop Contagion: Applying Network Science to Evaluate the Effectiveness of Covid-19 Vaccine Distribution Plans,2023-04-13,2023,jop
JOP,"Strengthening the Party, Weakening the Women: Unforeseen Consequences of Strengthening Institutions",2023-04-12,2023,jop
JOP,The persistent electoral effects of large-scale infrastructure policies: Evidence from a rural electrification scheme in Brazil,2023-04-04,2023,jop
JOP,"""The Wars of Others: The Effect of the Russian Invasion of Ukraine on Spanish Nationalism""",2023-04-03,2023,jop
JOP,Are Politicians Biased Against Ethnic Minority Candidates? Experimental Evidence from Norway,2023-03-10,2023,jop
JOP,Third Party Presence & the Political Salience of Ethnicity in Survey Data,2023-03-08,2023,jop
JOP,Playing to the Audience: Responses to Violations of International Order,2023-03-08,2023,jop
JOP,How Do We Know What We Know? Learning from Monte Carlo Simulations,2023-03-01,2023,jop
JOP,Assessing the Structure of Policy Preferences: A Hard Test of the Low Dimensionality Hypothesis,2023-02-26,2023,jop
JOP,Changing the Dialogue: Descriptive Candidacies & Position Taking in Campaigns for the U.S. House of Representatives,2023-02-26,2023,jop
JOP,"Replication Data for ""Enfranchisement and Representation: Evidence from the Introduction of Quasi-Universal Suffrage in Italy""",2023-02-21,2023,jop
JOP,Winning or Losing Hearts and Minds? Evidence from Afghanistan on how Leadership Decapitation affects Civilian Perceptions of Government Efficacy,2023-02-20,2023,jop
JOP,"""Jobs and Political Participation - Evidence from a Field Experiment in Ethiopia""",2023-02-20,2023,jop
JOP,The Effects of Racial Diversity in Citizen Decision-Making Bodies,2023-02-17,2023,jop
JOP,The Political Geography of the Gender Gap,2023-02-16,2023,jop
JOP,"Ethnic Inequality, Democratic Transitions, and Democratic Breakdowns : Investigating an Asymmetrical Relationship",2023-02-09,2023,jop
JOP,"Replication Data for ""Race to the Top: How Competition for Political Power Affects Participation""",2023-02-02,2023,jop
JOP,Political Misinformation and Factual Corrections on the Facebook News Feed: Experimental Evidence,2023-02-02,2023,jop
JOP,Domestic Polarization and International Rivalry: How Adversaries Respond to America's Partisan Politics,2023-02-01,2023,jop
JOP,Media Measurement Matters: Estimating the Persuasive Effects of Partisan Media with Survey and Behavioral Data,2023-01-26,2023,jop
JOP,Building the Party on the Ground: The Role of Access to Public Office for Party Growth,2023-01-20,2023,jop
JOP,Natural Disasters and Green Party Support,2023-01-18,2023,jop
JOP,"""Bilateral or Multilateral? International Financial Flows and the Dirty-Work Hypothesis""",2023-01-17,2023,jop
JOP,Does Land Quality Increase the Power of Traditional Leaders in Contemporary Africa?,2023-01-13,2023,jop
JOP,"Leader Hawkishness, Political Survival, and Interstate Crises",2023-01-10,2023,jop
JOP,The PhD Pipeline Initiative Works: Evidence from a Randomized Intervention to Help Under-Represented Students Prepare for PhDs in Political Science,2023-01-03,2023,jop
JOP,The Impact of Educational Content on Anti-Immigrant Attitudes,2023-01-03,2023,jop
JOP,Where’s the Party in Social Construction Theory?: Partisan Mappings of Politically Relevant Target Groups,2023-01-03,2023,jop
JOP,The Revolving Door and Regulatory Enforcement: Firm-level Evidence on Tax Rates and Tax Audits,2023-01-03,2023,jop
JOP,The Surprising Stability of Asian Americans’ and Latinos’ Partisan Identities in the Early Trump Era,2023-01-03,2023,jop
JOP,Comparing ‘responsible party government’ in the US and the UK,2022-12-21,2022,jop
JOP,Do Indirect Taxes Bite? How Hiding Taxes Erases Accountability Demands from Citizens,2022-12-21,2022,jop
JOP,"""Gradual Franchise Extensions and Government Spending in Nineteenth-Century England""",2022-12-16,2022,jop
JOP,Managing the Costs of Backing Down: A “Mirror Experiment” on Reputations and Audience Costs in a Real-World Conflict,2022-12-13,2022,jop
JOP,The Filibuster and Legislative Discussion,2022-12-13,2022,jop
JOP,When Do Campaign Donors Reject Extremists? Evidence from the U.S. Foreclosure Crisis,2022-12-09,2022,jop
JOP,"Framing Police Violence: Repression, Reform, and the Power of History in Chile",2022-12-09,2022,jop
JOP,The Effects of Independent Local Radio on Tanzanian Public Opinion: Evidence from a Planned Natural Experiment,2022-12-09,2022,jop
JOP,From Low-Cost Flights to the Ballot Box: How Eastern European Migration Shaped Far-Right Voting in London,2022-12-07,2022,jop
JOP,"Social Norm Change, Political Symbols, and Expression of Stigmatized Preferences",2022-12-07,2022,jop
JOP,Wait and see? Public Opinion Dynamics after Terrorist Attacks,2022-11-24,2022,jop
JOP,Defund My Police? The Effect of George Floyd's Murder on Support for Local Police Budgets,2022-11-15,2022,jop
JOP,Foreignness as an Asset: European Carbon Regulation and the Relocation Threat among Multinational Firms,2022-11-15,2022,jop
JOP,The Political Price of Authoritarian Control: Evidence from Francoist Land Settlements in Spain,2022-11-14,2022,jop
JOP,Schools of Thought: Leader Education and Policy Outcomes,2022-11-12,2022,jop
JOP,Women who win but do not rule. The effect of gender in the formation of governments,2022-11-10,2022,jop
JOP,"""Because He is Gay"": How Race, Gender, and Sexuality Shape Perceptions of Judicial Fairness",2022-11-09,2022,jop
JOP,Replication Data for Do local economic benefits of asylum seekers lead to more support for local refugee intake?,2022-11-08,2022,jop
JOP,The Effect of Firm Lobbying on High-Skilled Visa Adjudication,2022-11-08,2022,jop
JOP,"Making the bourgeoisie? Values, voice, and state-provided homeownership",2022-11-07,2022,jop
JOP,A Diffusion Network Event History Estimator,2022-10-31,2022,jop
JOP,Replication Data for From Investiture to Worms: European Development and the Rise of Political Authority,2022-10-29,2022,jop
JOP,“From ‘Is it unconfounded?’ to ‘How much confounding would it take?’: Applying the sensitivity-based approach to assess causes of support for peace in Colombia”,2022-10-28,2022,jop
JOP,Replication Data for Proportional Immigration Enforcement,2022-10-28,2022,jop
JOP,Perspective Taking Through Partisan Eyes,2022-10-23,2022,jop
JOP,Majority Minority Districts as Opportunities for Latina and Latino Representation,2022-10-23,2022,jop
JOP,Bargain Down or Shop Around? Outside Options and IMF Conditionality,2022-10-20,2022,jop
JOP,Trade as Villain: Belief in the American Dream and Declining Support for Globalization,2022-10-18,2022,jop
JOP,Strategically Ambiguous Identities: Evidence from Evangelical Clergy in Brazilian Elections,2022-10-14,2022,jop
JOP,Pork versus Policy: Experimental Evidence on Majoritarian Bargaining with Real-World Consequences,2022-10-11,2022,jop
JOP,Loyalty or Accountability? Public Attitudes to Holding Soldiers Accountable for the Murder and Abuse of Civilians,2022-10-11,2022,jop
JOP,Do political preferences affect policy learning and uptake? Evidence from a field experiment with informal entrepreneurs,2022-10-10,2022,jop
JOP,Extremists Not on Board: Labor market costs to radical behavior in elected office,2022-10-07,2022,jop
JOP,Committee Decision-Making under the Threat of Leaks,2022-10-07,2022,jop
JOP,The Supply--Equity Trade-off: The Effect of Spatial Representation on the Local Housing Supply,2022-10-06,2022,jop
JOP,Replication Data for Democratic Integration of Former Insurgents: Evidence from a Civic Inclusion Campaign in Colombia,2022-10-04,2022,jop
JOP,Larger Legislatures and the Cost of Political Brokerage: Evidence from Brazil,2022-09-22,2022,jop
JOP,Place-Based Campaigning: The Political Impact of Real Grassroots Mobilization,2022-09-21,2022,jop
JOP,Evaluating Escalation: Conceptualizing Escalation in an Era of Emerging Military Technologies,2022-09-14,2022,jop
JOP,Control and Fairness: What determines elected local leaders' support for hosting refugees in their community?,2022-09-13,2022,jop
JOP,Symbols of the Struggle: Descriptive Representation and Issue-Based Symbolism in U.S. House Speeches,2022-09-12,2022,jop
JOP,The Challenger's Winning Coalition: Mobilization of Religion in Ethnic Civil War.,2022-09-09,2022,jop
JOP,Estimation and Inference on Nonlinear and Heterogeneous Effects,2022-09-07,2022,jop
JOP,"Love Thy (Elected) Neighbor? Residential Segregation, Political Representation and Local Public Goods",2022-09-06,2022,jop
JOP,"""Compulsory Voting Diminishes the Relationship Between Winning and Satisfaction With Democracy""",2022-09-05,2022,jop
JOP,Motivated Corporate Political Action: Evidence from an SEC Experiment,2022-09-05,2022,jop
JOP,"Replication Data for ""The Bipartisan Path to Effective Lawmaking""",2022-09-02,2022,jop
JOP,Designing Electoral Districts for Proportional Representation Systems. How Electoral Geography and Partisan Politics Constrain Proportionality and Create Bias,2022-08-31,2022,jop
JOP,Facilitating Development: Evidence from a National-Level Experiment on Improving Bureaucratic Performance in Myanmar,2022-08-30,2022,jop
JOP,When do Economic Elites Support Increasing Taxation? Evidence from the American South,2022-08-29,2022,jop
JOP,Special Interests in Foreign Policy Bureaucracies: Evidence from Foreign Aid,2022-08-25,2022,jop
JOP,"Fake News, Fact Checking, and Partisanship: The Resilience of Rumors in the 2018 Brazilian Elections",2022-08-23,2022,jop
JOP,Fire Alarms for Police Patrols: Experimental Evidence on Co-Production of Public Safety,2022-08-18,2022,jop
JOP,Information Control and Public Support for Social Credit Systems in China,2022-08-13,2022,jop
JOP,Do Voting Advice Applications Change Political Behavior?,2022-08-12,2022,jop
JOP,Are Police Racially Biased in the Decision to Shoot?,2022-08-12,2022,jop
JOP,Replication Data for Evaluating Claims of Intersectionality,2022-08-12,2022,jop
JOP,Lobbyists as Gatekeepers: Theory and Evidence,2022-08-12,2022,jop
JOP,Political awareness and the identity-to-politics link in public opinion,2022-08-05,2022,jop
JOP,Never Forget the First Time: The Persistent Effects of Corruption and the Rise of Populism in Italy,2022-07-30,2022,jop
JOP,The Costs of Court Curbing,2022-07-30,2022,jop
JOP,Environmental Pollution and Authoritarian Politics,2022-07-28,2022,jop
JOP,Facial Recognition Technology and Voter Turnout,2022-07-27,2022,jop
JOP,"Unions, Class Identification and Policy Attitudes",2022-07-24,2022,jop
JOP,"Locked Down, Lashing Out: COVID-19 Effects on Asian Hate Crimes in Italy",2022-07-24,2022,jop
JOP,"""The Political Effects of Opioid Addiction Frames""",2022-07-14,2022,jop
JOP,Democratic Reputations in Crises and War,2022-06-13,2022,jop
JOP,Electoral Backlash or Positive Reinforcement? Wind Power and Congressional Elections in the United States,2022-05-18,2022,jop
JOP,Latino-targeted misinformation and the power of factual corrections,2022-05-03,2022,jop
JOP,Bureaucratic Revolving Doors and Interest Group Participation in Policymaking,2022-05-03,2022,jop
JOP,Officially Mobilizing: Repeated Reminders and Feedback from Local Officials Increase Turnout,2022-04-27,2022,jop
JOP,A Friend Like Me: The Effect of IO Membership on State Preferences,2022-04-27,2022,jop
JOP,Personalizing Moral Reframing in Interpersonal Conversation: A Field Experiment,2022-04-07,2022,jop
JOP,"Out of Sight, Out of Mind? Electoral Responses to Proximity of Health Care",2022-03-27,2022,jop
JOP,Mutual Dependence and Expectations of Cooperation,2022-03-23,2022,jop
JOP,Macro Outsourcing: Evaluating Government Reliance on the Private Sector,2022-03-15,2022,jop
JOP,How the Ultra-Rich Use Media Ownership as a Political Investment,2022-03-11,2022,jop
JOP,Constructive and Destructive Legislative Review: The Government-Opposition Divide in Parliamentary Oversight,2022-03-11,2022,jop
JOP,One-dimensional scaling without apologies,2022-03-09,2022,jop
JOP,Legislative Effectiveness in Multiparty Presidential Systems: Evidence from Mexico’s Chamber of Deputies,2022-03-03,2022,jop
JOP,Rock the Registration: Same Day Registration Increases Turnout of Young Voters,2022-02-14,2022,jop
JOP,The Politics of Stashing Wealth,2022-02-14,2022,jop
JOP,Public Opinion and Nuclear Use: Evidence from Factorial Experiments,2022-02-12,2022,jop
JOP,Constituents Ask Female Legislators to do More,2022-02-07,2022,jop
JOP,Peaceful Neighborhoods and Democratic Differences,2022-02-07,2022,jop
JOP,"Replication Data for ""Do shifts in late-counted votes signal fraud? Evidence from Bolivia""",2022-02-01,2022,jop
JOP,Ethnic Discrimination in Criminal Sentencing in China,2022-01-20,2022,jop
JOP,Knowing How to Give: IO Funding Knowledge and Public Support for Aid Delivery Channels,2022-01-11,2022,jop
JOP,What Makes a Successful Candidate? Political Experience and Low-Information Cues in Elections,2021-12-30,2021,jop
JOP,"Replication Data for ""Strategies of Contestation: International Law, Domestic Audiences, and Image Management""",2021-12-19,2021,jop
JOP,The Social Consequences of Political Anger,2021-12-09,2021,jop
JOP,All (Mayoral) Politics is Local?,2021-12-09,2021,jop
JOP,Authoritarian Infiltration of Organizations: Causes and Consequences,2021-12-09,2021,jop
JOP,Do Politicians Discriminate Against Constituents with an Immigration Background? Field Experimental Evidence from Germany,2021-12-09,2021,jop
JOP,Studying the Impact of ISIS Propaganda Campaigns,2021-12-09,2021,jop
JOP,The Effect of Wartime Legacies on Electoral Mobilization after Civil War,2021-12-09,2021,jop
JOP,Distinguishing between False Positives and Genuine Results: The Case of Irrelevant Events and Elections,2021-12-09,2021,jop
JOP,"More Money, More Turnout? Minimum Wage Increases and Voting",2021-12-09,2021,jop
JOP,How State and Protester Violence Affect Protest Dynamics,2021-12-09,2021,jop
JOP,"Replication Data for ""Trust in Public Policy Algorithms""",2021-12-09,2021,jop
JOP,"Replication Data for ""Persistent Inequealities: The Origins of Intergenerational Associations in Voter Turnout""",2021-12-09,2021,jop
JOP,Humiliation and International Conflict Preferences,2021-12-09,2021,jop
JOP,Peacekeeping and the Enforcement of Intergroup Cooperation: Evidence from Mali,2021-12-09,2021,jop
JOP,"How Voters Use Contextual Information to Reward and Punish: Credit Claiming, Legislative Performance, and Democratic Accountability",2021-12-09,2021,jop
JOP,"""Partisan Enclaves and Information Bazaars: Mapping Selective Exposure to Online News""",2021-12-09,2021,jop
JOP,"Solving Collective Action Problems under Separated and Shared Powers: The Benefits of Consolidating Executive Budgetary Powers, 1895-1940",2021-12-09,2021,jop
JOP,Contact and Context: How Municipal Traffic Stops Shape Citizen Character,2021-12-08,2021,jop
JOP,Partial Effects for Binary Outcome Models with Unobserved Heterogeneity,2021-12-08,2021,jop
JOP,Jailed While Presumed Innocent: The Demobilizing Effects of Pretrial Incarceration.,2021-12-03,2021,jop
JOP,Why Do Governments Tax or Subsidize Fossil Fuels?,2021-11-28,2021,jop
JOP,Just a Number? Voter Evaluations of Age in Candidate Choice Experiments,2021-11-25,2021,jop
JOP,Political Discontent is Associated with Isolating Personality Traits,2021-11-25,2021,jop
JOP,Democratic Hypocrisy and Out-group Threat: Explaining Citizen Support for Democratic Erosion,2021-11-25,2021,jop
JOP,Playing Politics with Environmental Protection: The Political Economy of Designating Protected Areas,2021-11-17,2021,jop
JOP,"The Growth of Campaign Advertising in the U.S., 1880 to 1930",2021-11-12,2021,jop
JOP,Does Public Opinion affect the Preferences of Foreign Policy Leaders? Experimental Evidence from the UK Parliament,2021-11-09,2021,jop
JOP,The Primary Path for Turning Legislative Effectiveness into Electoral Success,2021-11-07,2021,jop
JOP,Incentive Effects of Recall Elections: Evidence from Criminal Sentencing in California Courts,2021-11-06,2021,jop
JOP,You and Whose Army? How Civilian Leaders Leverage the Military’s Prestige to Shape Public Opinion,2021-11-02,2021,jop
JOP,The Real Consequences of Symbolic Politics: Breaking the Soviet Past in Ukraine,2021-11-02,2021,jop
JOP,Rock the Registration: Same Day Registration Increases Turnout of Young Voters,2021-11-01,2021,jop
JOP,On Constitutionalizing a Balanced Budget,2021-11-01,2021,jop
JOP,The 2016 Election and America's Standing Abroad: Quasi-Experimental Evidence of a Trump Effect,2021-10-27,2021,jop
JOP,"""Primary Divisions: How Voters Evaluate Policy and Group Differences in Intra-Party Contests""",2021-10-27,2021,jop
JOP,"""Who Supports QAnon? A Case Study in Political Extremism""",2021-10-27,2021,jop
JOP,Replication Datat fo Aiding War or Peace? The insiders’ view on aid to post-conflict transitions,2021-10-27,2021,jop
JOP,"Replication Data for ""Changing Hearts and Minds? Why Media Messages Designed to Foster Empathy Often Fail""",2021-10-27,2021,jop
JOP,Rebel Group Substitutes and Peace Agreement Amnesties,2021-10-27,2021,jop
JOP,The CPS Voting and Registration Supplement Overstates Minority Turnout,2021-10-27,2021,jop
JOP,Voters and Donors: The Unequal Political Consequences of Fracking,2021-10-27,2021,jop
JOP,Unmasking accountability: Judging performance in an interdependent world,2021-10-27,2021,jop
JOP,"Loyal Leaders, Affluent Agencies: The Budgetary Implications of Political Appointments in the Executive Branch",2021-10-27,2021,jop
JOP,Objective Facts and Elite Cues: Partisan Responses to Covid-19,2021-10-26,2021,jop
JOP,Confirmation Dynamics: Differential Vetting in the Appointment of U.S. Federal Agency Leaders,2021-10-26,2021,jop
JOP,Choice and Choice Set in African Elections,2021-09-21,2021,jop
JOP,Allocating Costly Influence in Legislatures,2021-09-09,2021,jop
JOP,Motivating the Machine: Which Brokers Do Parties Pay?,2021-09-03,2021,jop
JOP,"Replication Data for ""Political Appointments and Outcomes in Federal District Courts""",2021-08-21,2021,jop
JOP,Who Votes More Strategically? Evidence From Canada,2021-08-13,2021,jop
JOP,Partisan Influence in Suspicious Times,2021-08-08,2021,jop
JOP,Degrees of Disrespect,2021-08-05,2021,jop
JOP,The Morning After: Cabinet Instability and the Purging of Ministers after Failed Coup Attempts in Autocracies,2021-08-03,2021,jop
JOP,Replication Data for The Political Consequences of Ethnically Targeted Incarceration: Evidence from Japanese-American Internment During WWII,2021-07-30,2021,jop
JOP,Displacement and Dissimulation in the Syrian Civil War,2021-07-23,2021,jop
JOP,The Politics of Interruptions: Gendered Disruptions of Legislative Speeches,2021-07-21,2021,jop
JOP,Hierarchical Oversight and the Value of Public Office: Evidence from Colonial Peru,2021-07-14,2021,jop
JOP,Competence versus Priorities: Negative Electoral Responses to Education Quality in Brazil,2021-07-14,2021,jop
JOP,"FDI, Unmet Expectations, and the Prospects of Political Leaders: Evidence from Chinese Investment in Africa",2021-07-13,2021,jop
JOP,Black Workers in White Places: Daytime Racial Diversity and White Public Opinion,2021-07-13,2021,jop
JOP,Experimentally Estimating Safety in Numbers in a Single-Party Legislature,2021-07-01,2021,jop
JOP,Audits for Accountability: Evidence from Municipal By-Elections in South Africa,2021-06-23,2021,jop
JOP,"Replication data for: ""All (Mayoral) Politics is Local?""",2021-06-23,2021,jop
JOP,Who Does Voter ID Keep from Voting?,2021-06-17,2021,jop
JOP,The Economic Costs of Democratic Backsliding? Backsliding and State Location Preferences of U.S. Job-seekers,2021-06-14,2021,jop
JOP,Distributional Consequences of Philanthropic Contributions to Public Goods: Self-Serving Elite in Ottoman Istanbul,2021-06-11,2021,jop
JOP,The Missionary Roots of Nationalism: Evidence from China,2021-05-28,2021,jop
JOP,Replication code for Fighting Propaganda with Censorship: A Study of the Ukrainian Ban on Russian Social Media,2021-05-21,2021,jop
JOP,"""Same As It Ever Was? The Impact of Racial Resentment on White Juror Decision-Making""",2021-04-21,2021,jop
JOP,"Corruption, Accountability, and Women’s Access to Power",2021-04-16,2021,jop
JOP,Protest Participation and Attitude Change: Evidence from Ukraine's Euromaidan Revolution,2021-04-14,2021,jop
JOP,Leadership Targeting and Militant Alliance Breakdown,2021-04-14,2021,jop
JOP,"Sensitive Questions, Spillover Effects, and Asking About Citizenship on the U.S. Census",2021-03-22,2021,jop
JOP,"Replication Package for ""Do Major-Power Interventions Encourage the Onset of Civil Conflict? A Structural Analysis""",2020-12-27,2020,jop
JOP,Decree power in parliamentary systems: Theory and evidence from India,2020-12-26,2020,jop
JOP,Can International Courts Enhance Domestic Judicial Review? Separation of Powers and the European Court of Justice,2020-12-21,2020,jop
JOP,How Campaigns Respond to Ballot Position: A New Mechanism for Order Effects,2020-12-21,2020,jop
JOP,Offsetting Policy Feedback Effects: Evidence from the Affordable Care Act,2020-12-21,2020,jop
JOP,"U.S. Patronage, State Capacity, and Civil Conflict",2020-12-21,2020,jop
JOP,How does armed conflict shape investment? Evidence from the mining sector,2020-12-21,2020,jop
JOP,Evaluations of Violence at the Polls: Civilian Victimization and Support for Perpetrators After War,2020-12-21,2020,jop
JOP,Business Owners and Executives as Politicians: The Effect on Public Policy,2020-12-21,2020,jop
JOP,Understanding Journalist Killings,2020-12-21,2020,jop
JOP,Home-price subsidies increase local-level political participation in urban India,2020-12-20,2020,jop
JOP,Not All Elections Are Created Equal: Election Quality and Civil Conflict,2020-12-19,2020,jop
JOP,Deadly Populism: How Local Political Outsiders Drive Duterte’s War on Drugs in the Philippines,2020-12-10,2020,jop
JOP,"Replication Code for ""Can Good Politicians Compensate for Bad Institutions? Evidence from an original survey of Italian mayors""",2020-12-10,2020,jop
JOP,Do Belief Systems Exhibit Dynamic Constraint?,2020-12-10,2020,jop
JOP,How often do people vote while incarcerated? Evidence from Maine and Vermont,2020-12-10,2020,jop
JOP,What Makes Anticorruption Punishment Popular? Individual-level Evidence from China,2020-12-10,2020,jop
JOP,ANES Scales Often Don’t Measure What You Think They Measure,2020-12-10,2020,jop
JOP,Leviathan's Latent Dimensions: Measuring State Capacity for Comparative Political Research,2020-12-10,2020,jop
JOP,Changing Tides: Public Attitudes on Climate Migration,2020-12-10,2020,jop
JOP,"Trojan Horse, Copycat, or Scapegoat? Unpacking the Refugees-Terrorism Nexus",2020-11-19,2020,jop
JOP,Do transitional justice museums persuade visitors? Evidence from a field experiment,2020-11-08,2020,jop
JOP,Agricultural Comparative Advantage and Legislators' Support for Trade Agreements,2020-11-02,2020,jop
