dataverse,article,date,year,journal
JOP,Let’s Just Agree to Disagree: Dispute Resolution Mechanisms in Coalition Agreements,2016-03-16,2016,jop
JOP,Money in Exile: Campaign Contributions and Committee Access,2016-03-14,2016,jop
JOP,"Replication Data for ""Defense Pacts and Deterrence: Caveat Emptor""",2016-03-12,2016,jop
JOP,"""The Contraction Effect: How Proportional Representation Affects Mobilization and Turnout""",2016-03-12,2016,jop
JOP,The Political Legacy of American Slavery,2016-03-04,2016,jop
JOP,Partisanship by Invitation: Immigrants Respond to Political Campaigns,2016-03-04,2016,jop
JOP,"Replication Data for ""Context and Political Knowledge: Explaining Cross-National Variation in Partisan Left-Right Knowledge""",2016-02-23,2016,jop
JOP,Estimating Vote-Specific Preferences from Roll-Call Data using Conditional Autoregressive Priors,2016-02-21,2016,jop
JOP,Mayoral Partisanship and Municipal Fiscal Policy,2016-02-21,2016,jop
JOP,Are We in the Same Boat or Not? The Opposite Effects of Absolute and Relative Income Shifts on Redistributive Preferences,2016-02-09,2016,jop
JOP,Time is Power: The Non-Institutional Sources of Stability in Autocracies,2016-02-08,2016,jop
JOP,Replication Data for Bureaucratic Investments in Expertise,2016-02-02,2016,jop
JOP,Strategic Retirements of Elected and Appointed Justices: A Hazard Model Approach,2016-01-28,2016,jop
JOP,"""Inequality and Electoral Accountability: Class-Biased Economic Voting in Comparative Perspective""",2016-01-28,2016,jop
JOP,"Political Context, Government Redistribution, and the Public's Response to Growing Economic Inequality",2016-01-19,2016,jop
JOP,"""Do All Good Things Go Together? Development Assistance and Insurgent Violence in Civil War""",2016-01-16,2016,jop
JOP,Are Costly Signals More Credible? Evidence of Sender-Receiver Gaps,2016-01-15,2016,jop
JOP,Economic hardship triggers identification with disadvantaged minorities,2016-01-05,2016,jop
JOP,"""Moderate as Necessary. The Role of Electoral Competitiveness and Party Size in Explaining Parties' Policy Shifts.""",2016-01-05,2016,jop
JOP,"Replication Data for ""Group Empathy Theory: The Effect of Group Empathy on U.S. Intergroup Attitudes and Behavior in the Context of Immigration Threats""",2015-12-29,2015,jop
JOP,"""Personality, Interpersonal Disagreement, and Electoral Information.""",2015-12-17,2015,jop
JOP,"Replication Data for ""The Electoral Benefits of Opportunistic Election Timing""",2015-12-17,2015,jop
JOP,A Better Life for All? Democratization and Electrification in Post-Apartheid South Africa,2015-12-14,2015,jop
JOP,"""Mediating the Electoral Connection: The Information Effects of Voter Signals on Legislative Behavior""",2015-12-09,2015,jop
