dataverse,article,date,year,journal
JOP,'On Board with Banks: Do Banking Connections Help Politicians Win Elections?',2018-06-05,2018,jop
JOP,"The Political Weaponization of Gun Owners: The NRA's Cultivation, Dissemination, and Use of a Group Social Identity",2018-06-05,2018,jop
JOP,"Replication Data for ""Empowering Women? Gender Quotas and Women's Political Careers""",2018-06-04,2018,jop
JOP,Replication Data for Fiscal Capacity and Inequality: Evidence from Brazilian Municipalities,2018-06-04,2018,jop
JOP,Greasing the Wheels of Commerce? Corruption and Foreign Investment,2018-05-31,2018,jop
JOP,What Makes Foreign Policy Teams Tick: Explaining Variation in Group Performance At Geopolitical Forecasting,2018-05-24,2018,jop
JOP,"Replication Data for One Party States and Legislator Extremism in the U.S. House, 1876-2012",2018-05-24,2018,jop
JOP,"""Getting Rich Too Fast? Voters' Reactions to Politicians' Wealth Accumulation""",2018-05-23,2018,jop
JOP,Mutual Optimism and Costly Conflict: The Case of Naval Battles in the Age of Sail,2018-05-17,2018,jop
JOP,Knock out Blows or the Status Quo? Momentum in the 2016 Primaries,2018-05-15,2018,jop
JOP,Economists and Public Opinion: Expert Consensus and Economic Policy Judgments,2018-05-12,2018,jop
JOP,Casual Physical Contact and Out-group Bias: Experimental Evidence from Afghanistan,2018-05-08,2018,jop
JOP,The Power to Appoint: Presidential Nominations and Change on the Supreme Court,2018-05-03,2018,jop
JOP,Gendered Political Contexts: The Gender Gap in Political Knowledge,2018-05-03,2018,jop
JOP,"Replication Data for ""How Autocrats Manipulate Economic News: Evidence from Russia’s State-Controlled Television.""",2018-05-01,2018,jop
JOP,How Negative Sentiment towards Muslim Americans Predicts Support for Trump in the 2016 Presidential Election,2018-04-27,2018,jop
JOP,Implicit Attitudes Toward an Authoritarian Regime,2018-04-25,2018,jop
JOP,Are Donation-Based Measures of Ideology Valid Predictors of Individual-Level Policy Preferences?,2018-04-25,2018,jop
JOP,The Divided Labor of Attack Advertising in Congressional Campaigns,2018-04-24,2018,jop
JOP,Guilt by Association: White Collective Guilt in American Politics,2018-04-23,2018,jop
JOP,"""Bounding Partisan Approval Rates Under Endogenous Partisanship: Why High Presidential Partisan Approval May Not Be What It Seems""",2018-04-23,2018,jop
JOP,"Replication Data for ""How Dispositional Empathy Influences Political Ambition""",2018-04-18,2018,jop
JOP,"Politicization and Expertise: Exit, Effort, and Investment",2018-04-15,2018,jop
JOP,Why friends and neighbors? Explaining the electoral appeal of local roots,2018-04-09,2018,jop
JOP,"""A Race to the Middle. The Politics of Interstate Cost Distribution and Welfare State Expansion""",2018-04-09,2018,jop
JOP,The Impact of Personalized Information on Vote Intention: Evidence from a Randomized Field Experiment,2018-04-04,2018,jop
JOP,Groceries for Votes: The Electoral Returns of Vote Buying,2018-04-03,2018,jop
JOP,"Elections, Protest and Trust in Government: A Natural Experiment from Russia",2018-03-27,2018,jop
JOP,Patronage Appointments and Agency Independence,2018-03-27,2018,jop
JOP,The Muted Consequences of Correct Information about Immigration,2018-03-27,2018,jop
JOP,The Credibility of Party Policy Rhetoric: Survey Experimental Evidence,2018-03-25,2018,jop
JOP,"""Who's to Blame? Political Centralization and Electoral Punishment under Authoritarianism""",2018-03-23,2018,jop
JOP,A Signaling Theory of Distributive Policy Choice: Evidence from Senegal,2018-03-23,2018,jop
JOP,"""How Incivility on Partisan Media (De-)Polarizes the Electorate""",2018-03-22,2018,jop
JOP,"Pivotal Politics, Partisan Polarization, and Policy Predictability",2018-03-19,2018,jop
JOP,"Replication Data for ""Economic Institutions and Autocratic Breakdown: Monetary Constraints and Fiscal Spending in Dominant-Party Regimes""",2018-03-16,2018,jop
JOP,"Replication Data for ""We all Agree: Strict Voter ID Laws Disproportionately Burden Minorities""",2018-03-12,2018,jop
JOP,Nonpartisans as False Negatives: The Mismeasurement of Party Identification in Public Opinion Surveys,2018-03-12,2018,jop
JOP,"Strength in Expectation: Elections, Economic Performance and Authoritarian Breakdown",2018-03-06,2018,jop
JOP,A Tale of Two Democrats: How Authoritarianism Divides the Democratic Party,2018-03-04,2018,jop
JOP,Party Calls and Reelection in the U.S. Senate,2018-03-04,2018,jop
JOP,Everybody Hurts Sometimes: How Personal and Collective Insecurities Shape Policy Preferences,2018-03-01,2018,jop
JOP,Conspiracy and Misperception Belief in the Middle East and North Africa,2018-02-25,2018,jop
JOP,"The Differential Effects of ""Democratic"" Institutions on Dissent in Dictatorships",2018-02-25,2018,jop
JOP,Natural Resource Exploitation and Sexual Violence by Rebel Groups,2018-02-20,2018,jop
JOP,Economic Responsiveness and the Political Conditioning of the Electoral Cycle,2018-02-20,2018,jop
JOP,"""How Attribution Inhibits Accountability: Evidence from Train Delays""",2018-02-20,2018,jop
JOP,"Having their Say: Authority, Voice, and Satisfaction with Democracy",2018-02-20,2018,jop
JOP,The Social Costs of Public Political Participation: Evidence from a Petition Experiment in Lebanon,2018-02-20,2018,jop
JOP,Inter-regional Inequality and the Dynamics of Government Spending,2018-02-20,2018,jop
JOP,Socialization or experience? Institutional trust and satisfaction with democracy among emigrants in different institutional settings,2018-02-20,2018,jop
JOP,Framing and Blame Attribution in Populist Rhetoric,2018-02-14,2018,jop
JOP,"Uncertainty, Cleavages and Ethnic Coalitions",2018-02-14,2018,jop
JOP,Redistributive Political Transitions: Minority Rule and Liberation Wars in Colonial Africa,2018-02-12,2018,jop
JOP,Can Development Aid Empower Women? Evidence from a Field Experiment in the Congo,2018-02-12,2018,jop
JOP,Intra-Elite Competition and Long-Run Fiscal Development,2018-02-04,2018,jop
JOP,"Political Issues, Evidence, and Citizen Engagement: The Case of Unequal Access to Affordable Health Care",2018-02-01,2018,jop
JOP,Electoral Volatility in Latin America,2018-01-26,2018,jop
JOP,Politicization and Responsiveness in Executive Agencies,2018-01-25,2018,jop
JOP,Actions Versus Consequences in Political Arguments: Insights from Moral Psychology,2018-01-25,2018,jop
JOP,Legislative Effectiveness in the United States Senate,2018-01-17,2018,jop
JOP,"""Restrained Change: Party Systems in Times of Economic Crisis""",2018-01-16,2018,jop
JOP,"""Crime, Conflict and the Legitimacy Tradeoff: Explaining Variation in Insurgents' Participation in Crime""",2018-01-12,2018,jop
JOP,"""Gerrymandering Incumbency: Does Nonpartisan Redistricting Increase Electoral Competition?""",2018-01-12,2018,jop
JOP,The Absence of Consumer Interests in Trade Policy,2018-01-11,2018,jop
JOP,The Structure of Ethnic Inequality and Ethnic Voting,2018-01-11,2018,jop
JOP,Party Leader or Party Reputation Concerns? How Vertical Partisan Alignment Reins in Subnational Fiscal Profligacy,2018-01-11,2018,jop
JOP,"""When Does a Group of Citizens Influence Policy? Evidence from Senior Citizen Participation in City Politics""",2018-01-10,2018,jop
JOP,"""Economic Reasoning with a Racial Hue: Is the Immigration Consensus Purely Race Neutral?""",2017-12-17,2017,jop
JOP,"Elite Coalitions, Limited Government, and Fiscal Capacity Development: Evidence from Bourbon Mexico",2017-12-17,2017,jop
JOP,Genetic Attributions: Sign of Intolerance or Acceptance?,2017-12-15,2017,jop
JOP,"""Signaling sophistication: How social expectations can increase political information acquisition""",2017-12-11,2017,jop
JOP,"Replication Data for ""Legislative Rules in an Electoral Authoritarian System""",2017-12-07,2017,jop
JOP,Can the Government Deter Discrimination? Evidence from a Randomized Intervention in New York City,2017-12-04,2017,jop
JOP,The Importance of Knowing ‘What Goes With What’: Reinterpreting the Evidence on Policy Attitude Stability,2017-12-01,2017,jop
JOP,Measuring Morality in Political Attitude Expression,2017-11-29,2017,jop
JOP,Revolving Door Lobbyists and the Value of Congressional Staff Connections,2017-11-29,2017,jop
JOP,Resist to Commit: Concrete Campaign Statements and the Need to Clarify a Partisan Reputation,2017-11-26,2017,jop
JOP,Social Signals and Participation in the Tunisian Revolution,2017-11-21,2017,jop
JOP,The Pathology of Hard Propaganda,2017-11-20,2017,jop
JOP,Language Influences Public Attitudes Toward Gender Equality,2017-11-01,2017,jop
JOP,The Effect of the Voting Rights Act on Enfranchisement: Evidence from North Carolina,2017-10-25,2017,jop
JOP,"Share the Name, Share the Vote: A Natural Experiment of Name Recognition",2017-10-25,2017,jop
JOP,"Multiple Measurements, Elusive Agreement, and Unstable Outcomes in the Study of Regime Change",2017-10-23,2017,jop
JOP,"Decomposing Public Opinion Variation into Ideology, Idiosyncrasy and Instability",2017-10-18,2017,jop
JOP,The Home as a Political Fortress; Family Agreement in an Era of Polarization,2017-10-12,2017,jop
JOP,Selling ourselves short? How abbreviated measures of personality change the way we think about personality and politics,2017-10-10,2017,jop
JOP,"Replication Data for ""Nice Girls? Sex, Collegiality, and Bipartisan Cooperation in the U.S. Congress""",2017-10-09,2017,jop
JOP,Electoral and Partisan Cycles in Counterterrorism,2017-10-05,2017,jop
JOP,Policing the Administrative State,2017-10-05,2017,jop
JOP,"""The Electoral Consequences of Issue Frames""",2017-10-02,2017,jop
JOP,The Delegate Paradox: Why Polarized Politicians Can Represent Citizens Best,2017-09-28,2017,jop
JOP,From Pork to Policy: The Rise of Programmatic Campaigning in Japanese Elections,2017-09-28,2017,jop
JOP,Could global democracy satisfy diverse policy values? An empirical analysis,2017-09-20,2017,jop
JOP,Polarized Mass or Polarized Few? Assessing the Parallel Rise of Survey Non-Response and Measures of Polarization,2017-09-20,2017,jop
JOP,Corruption as an Only Option: The Limits to Electoral Accountability,2017-09-18,2017,jop
JOP,"Information, Knowledge and Attitudes: An Evaluation of the Taxpayer Receipt",2017-09-15,2017,jop
JOP,"Replication Data for ""Voter Reactions to Incumbent Opportunism""",2017-09-14,2017,jop
JOP,Comment on “Voter Identification Laws and the Suppression of Minority Votes”,2017-09-14,2017,jop
JOP,"Science, Sexuality, and Civil Rights: Does Information on the Causes of Sexual Orientation Change Attitudes?",2017-09-14,2017,jop
JOP,Replication Data for Elite Perceptions of Agency Ideology and Workforce Skill,2017-09-12,2017,jop
JOP,Ethnocentrism Reduces Foreign Direct Investment,2017-09-11,2017,jop
JOP,"""Do Enclaves Remediate Social Inequality?""",2017-09-05,2017,jop
JOP,Mirrors for Princes and Sultans:Advice on the Art of Governance in the Medieval Christian and Islamic Worlds,2017-09-05,2017,jop
JOP,"Cabinets, Committees and Careers: The Causal Effect of Committee Service",2017-09-05,2017,jop
JOP,Do Shark Attacks Influence Presidential Elections? Reassessing a Prominent Finding on Voter Competence,2017-08-29,2017,jop
JOP,"Clayton and Zetterberg ""Quota Shocks: Electoral Gender Quotas and Government Spending Priorities Worldwide""",2017-08-29,2017,jop
JOP,"How Politics Affects Religion: Partisanship, Socialization, and Religiosity in America",2017-08-29,2017,jop
JOP,Electoral Rules and Partisan Control of Government: A Replication Study,2017-08-24,2017,jop
JOP,The Parties in our Heads: Misperceptions About Party Composition and Their Consequences,2017-08-24,2017,jop
JOP,The Promise of Modeling Political Information Transmission as a Game of Telephone,2017-08-24,2017,jop
JOP,Making It Personal: The Role of Leader-Specific Signals in Extended Deterrence,2017-08-16,2017,jop
JOP,"""Pollution Lowers Support for China's Regime: Quasi-Experimental Evidence from Beijing""",2017-08-15,2017,jop
JOP,Free-Riding on Enforcement in the WTO,2017-08-09,2017,jop
JOP,Who Matches? Propensity Scores and Bias in the Causal Effects of Education on Participation,2017-08-08,2017,jop
JOP,"Corruption, accountability and gender: do female politicians face higher standards in public life?",2017-08-08,2017,jop
JOP,Can’t Buy Them Love: How Party Culture among Donors Contributes to the Party Gap in Women’s Representation,2017-08-02,2017,jop
JOP,"Partisan goals, emotions, and political mobilization: The role of motivated reasoning in pressuring others to vote",2017-07-24,2017,jop
JOP,"Polarization, Demographic Change, and White Flight from the Democratic Party",2017-07-24,2017,jop
JOP,The Changing Norms of Racial Political Rhetoric and the End of Racial Priming,2017-07-10,2017,jop
JOP,"How the West Was Won: Competition, Mobilization, and Women’s Enfranchisement in the United States",2017-07-07,2017,jop
JOP,"Political Advantage, Disadvantage, and the Demand for Partisan News",2017-07-07,2017,jop
JOP,Fear of Gender Favoritism and Vote Choice during the 2008 Presidential Primaries,2017-07-06,2017,jop
JOP,"Replication data for ""Primary Elections and the Provision of Public Goods""",2017-06-28,2017,jop
JOP,"Are you my mentor? A field experiment on gender, ethnicity, and political self-starters",2017-06-27,2017,jop
JOP,Misperceptions of Relative Affluence and Support for International Redistribution,2017-06-27,2017,jop
JOP,"Replication Data for ""Does Counterinsurgent Success Match Social Support? Evidence from a Survey Experiment in Colombia""",2017-06-27,2017,jop
JOP,"Replication Data for ""When the Pound in People’s Pocket Matters: How changes to personal financial circumstances affect party choice""",2017-06-14,2017,jop
JOP,Clear as Black and White: The Effects of Ambiguous Rhetoric Depend on Candidate Race,2017-06-12,2017,jop
JOP,Local Union Organization and Lawmaking in the U.S. Congress,2017-06-05,2017,jop
JOP,"""Uncovering Reactions to the Racial Resentment Scale Across the Racial Divide.""",2017-06-05,2017,jop
JOP,The Paradoxical Effect of Speech-Suppressing Appeals to the First Amendment,2017-06-05,2017,jop
JOP,Type II Audience Costs,2017-05-30,2017,jop
JOP,"""Unpaved Road Ahead: The Consequences of Election Cycles for Capital Expenditures""",2017-05-30,2017,jop
JOP,The Broad Impact of a Narrow Conflict: How Natural Resource Windfalls Shape Policy and Politics,2017-05-30,2017,jop
JOP,Show Me Your Friends: Evidence from a Survey Experiment on the Effect of Coalition Signals,2017-05-26,2017,jop
JOP,Contributions by Interest Groups to Lobbying Coalitions,2017-05-26,2017,jop
JOP,My Trust in Government is Implicit: Automatic Trust in Government and System Support,2017-05-24,2017,jop
JOP,Dividing the Dollar with Formulas,2017-05-24,2017,jop
JOP,The Decline of Local News and Its Effects: New Evidence from Longitudinal Data,2017-05-16,2017,jop
JOP,Left/Right or U? Estimating the Dimensionality of National Party Competition in Europe,2017-05-09,2017,jop
JOP,Never Let A Good Crisis Go To Waste: Agenda Setting and Legislative Voting in Response to the EU Crisis,2017-05-09,2017,jop
JOP,Wanting What is Fair: How Party Cues and Information about Income Inequality Affect Public Support for Taxes,2017-05-08,2017,jop
JOP,How Hard to Fight? Cross-Player Effects and Strategic Sophistication in an Asymmetric Contest Experiment,2017-05-02,2017,jop
JOP,Agents of the Regime? Traditional Leaders and Electoral Politics in South Africa,2017-04-26,2017,jop
JOP,Does the Gift Keep on Giving?: House Leadership PAC Donations Before and After Majority Status,2017-04-26,2017,jop
JOP,Backchannel Representation: A Study of the Strategic Communication of Senators with the U.S. Department of Labor,2017-04-24,2017,jop
JOP,Electoral Cycle Fluctuations in Partisanship: Global Evidence from 86 Countries,2017-04-24,2017,jop
JOP,"""Off-Cycle and Out of Office: Election Timing and the Incumbency Advantage""",2017-04-19,2017,jop
JOP,"""Executive Power and Economic Accountability"" by Ryan E. Carlin and Shane P. Singh",2017-04-14,2017,jop
JOP,Why Partisans Don't Sort,2017-04-14,2017,jop
JOP,Government Fragmentation and Public Goods Provision,2017-04-14,2017,jop
JOP,External Validity in Parallel Global Field and Survey Experiments on Anonymous Incorporation,2017-04-14,2017,jop
JOP,Eggers and Spirling -- Incumbency Effects and the Strengths of Party Preferences: Evidence from Multiparty Elections in the UK,2017-04-14,2017,jop
JOP,The Authoritarian Left Withdraws From Politics: Ideological Asymmetry in the Relationship Between Authoritarianism and Political Engagement (Replication Data),2017-04-14,2017,jop
JOP,Joining the Club: Accession to the GATT/WTO,2017-04-14,2017,jop
JOP,Governing Well after War: How Improving Female Representation Prolongs Post-conflict Peace,2017-04-14,2017,jop
JOP,"Me, Myself, and (I), (D) or (R)? Partisanship and Political Cognition through the Lens of Implicit Identity",2017-04-14,2017,jop
JOP,Corporate Influence in World Bank Lending,2017-04-14,2017,jop
JOP,Reassessing Public Support for a Female President,2017-04-14,2017,jop
JOP,Electoral Volatility and Turnout: Party Entry and Exit in Indian Elections,2017-04-12,2017,jop
JOP,The Physiology of Framing Effects: Threat Sensitivity and the Persuasiveness of Political Arguments,2017-04-03,2017,jop
JOP,"""Modern Police Tactics, Police-Citizen Interactions and the Prospects for Reform",2017-03-30,2017,jop
JOP,Telling the Truth about Believing the Lies?,2017-03-16,2017,jop
JOP,Elite Investments in Party Institutionalization in New Democracies: A Two-Dimensional Approach,2017-03-16,2017,jop
JOP,China's Ideological Spectrum,2017-03-06,2017,jop
JOP,Intergovernmental Organizations and Democratic Victory in International Crises,2017-03-02,2017,jop
JOP,"Food Comes First, Then Morals: Redistribution Preferences, Parochial Altruism and Immigration in Western Europe",2017-03-02,2017,jop
JOP,Replication Files for: The Consequences of Elite Party Politics for American Macropartisanship,2017-03-02,2017,jop
JOP,Passing It Along: Experiments on Creating the Negative Externalities of Climate Change,2017-02-07,2017,jop
JOP,"Replication Data Foreign Aid, Foreign Policy, and Government Legitimacy: Experimental Evidence from Bangladesh",2017-02-07,2017,jop
JOP,How Natural Resources Affect Authoritarian Leaders' Provision of Public Services: Evidence from China,2017-02-06,2017,jop
JOP,Local Embeddedness and Bureaucratic Performance: Evidence from India,2017-01-30,2017,jop
JOP,"""Who Pays for Government? Descriptive Representation and Exploitative Revenue Sources""",2017-01-30,2017,jop
JOP,"Americans, Not Partisans: Can Priming American National Identity Reduce Affective Polarization?",2017-01-24,2017,jop
JOP,Are Voting Norms Conditional? How Electoral Context and Peer Behavior Shape the Social Returns to Voting,2017-01-24,2017,jop
JOP,The Politics of Central Bank Appointments,2017-01-24,2017,jop
JOP,Relative Economic Performance and the Incumbent Vote: A Reference Point Theory,2017-01-14,2017,jop
JOP,"How Far does Social Group Influence Reach? Identities, Elites, and Immigration Attitudes",2017-01-14,2017,jop
JOP,The Political Legacy of Violence: The Long-Term Impact of Stalin’s Repression in Ukraine,2017-01-05,2017,jop
JOP,Assessing Contextual Measurement Strategies,2017-01-05,2017,jop
JOP,"""The Four Faces of Political Participation in Argentina: Using Latent Class Analysis To Study Political Behavior""",2017-01-05,2017,jop
JOP,Economic Inequality and Class Consciousness,2016-12-23,2016,jop
JOP,Does Incarceration Reduce Voting? Evidence about the Political Consequences of Spending Time in Prison,2016-12-23,2016,jop
JOP,"Replication Data for ""Economic Downturns and Political Competition Since the 1870s""",2016-12-23,2016,jop
JOP,Presidential voting and the local economy,2016-12-12,2016,jop
JOP,Institutional Control of Redistricting and the Geography of Representation,2016-12-08,2016,jop
JOP,Learning Together Slowly: Bayesian Learning About Political Facts,2016-12-06,2016,jop
JOP,Incremental Democracy: The Policy Effects of Partisan Control of State Government,2016-11-28,2016,jop
JOP,Attribution Errors in Federalist Systems: When Voters Punish the President for Local Tax Increases,2016-11-14,2016,jop
JOP,Does the Hijab Increase Representatives’ Perceptions of Social Distance?,2016-11-01,2016,jop
JOP,The Role of the Information Environment in Partisan Voting,2016-10-31,2016,jop
JOP,"Trading Interests: Domestic Institutions, International Negotiations, and the Politics of Trade",2016-10-25,2016,jop
JOP,Ex Post Lobbying,2016-10-25,2016,jop
JOP,Quality-Based Incumbency Effects,2016-10-14,2016,jop
JOP,"Replication Data for ""Elections and Divisiveness: Theory and Evidence""",2016-10-14,2016,jop
JOP,"Replication Data for ""The Effect of Network Structure on Preference Formation""",2016-10-07,2016,jop
JOP,"""Constituency Service Under Nondemocratic Rule: Evidence from China.""",2016-10-04,2016,jop
JOP,The Promise and Limits of Election Observers in Building Election Credibility,2016-10-03,2016,jop
JOP,Lagged Explanatory Variables and the Estimation of Causal Effects,2016-09-29,2016,jop
JOP,Keeping One’s Seat: The Competiveness of MP Renomination in Mixed-Member Electoral Systems,2016-09-29,2016,jop
JOP,"Slow-Rolling, Fast-Tracking, and the Pace of Bureaucratic Decisions in Rulemaking",2016-09-27,2016,jop
JOP,"Droughts, Land Appropriation, and Rebel Violence in The Developing World",2016-09-27,2016,jop
JOP,"Capturing the Airwaves, Capturing the Nation? A Field Experiment on State-Run Media Effects in the Wake of a Coup",2016-09-15,2016,jop
JOP,The Effects of Congressional Staff Networks in the U.S. House of Representatives,2016-08-23,2016,jop
JOP,Black Candidates and Black Turnout: A Study of Viability in Louisiana Mayoral Elections,2016-08-12,2016,jop
JOP,"Voting then, voting now: The long term consequences of participation in South Africa's rst democratic election",2016-08-08,2016,jop
JOP,The Effects of District Magnitude on Voting Behavior,2016-08-08,2016,jop
JOP,Descriptive Representation and Political Efficacy: Evidence from Obama and Clinton,2016-08-04,2016,jop
JOP,Personal Experience and Public Opinion: A Theory and Test of Conditional Policy Feedback,2016-07-26,2016,jop
JOP,The Problem of Shared Victory: War-Winning Coalitions and Postwar Peace,2016-07-25,2016,jop
JOP,Weighting Parties and Coalitions: How Coalition Signals Influence Voting Behavior,2016-07-22,2016,jop
JOP,The Politics of Potholes: Service Quality and Retrospective Voting in Local Elections,2016-07-21,2016,jop
JOP,Assessing Ballot Structure and Split Ticket Voting: Evidence from a Quasi-Experiment,2016-07-12,2016,jop
JOP,The Political Relevance of Irrelevant Events,2016-07-08,2016,jop
JOP,Investing in Violence: Foreign Direct Investment and Coups in Authoritarian Regimes,2016-06-30,2016,jop
JOP,Do Good Borders Make Good Rebels? Territorial Control and Civilian Casualties?,2016-06-27,2016,jop
JOP,"Replication data and code for: Maria Carreri and Oeindrila Dube, ""Do Natural Resources Influence Who Comes to Power, and How?""",2016-06-24,2016,jop
JOP,Political Economy of Sovereign Debt: Global Finance and Electoral Cycles,2016-06-22,2016,jop
JOP,Dictators in Exile: Explaining the Destinations of Ex-Rulers,2016-06-21,2016,jop
JOP,"Presidents, Policy Compromise and Legislative Success",2016-06-15,2016,jop
JOP,Voter Identification Laws and the Suppression of Minority Votes,2016-06-14,2016,jop
JOP,"""The Civic Opportunity Cost of Entertainment""",2016-06-14,2016,jop
JOP,"""American Employers as Political Machines""",2016-06-13,2016,jop
JOP,Off to a Bad Start: Unemployment and Political Interest during Early Adulthood,2016-06-13,2016,jop
JOP,Legibility and the Informational Foundations of State Capacity,2016-06-02,2016,jop
JOP,The Limits of Partisan Prejudice,2016-06-02,2016,jop
JOP,Policy Preferences in Coalition Formation and the Stability of Minority and Surplus Governments,2016-06-02,2016,jop
JOP,Racial Diversity and the Dynamics of Authoritarianism,2016-05-30,2016,jop
JOP,"Interests, Information and Minority Influence in Deliberation",2016-05-27,2016,jop
JOP,Congressional Candidates in the Era of Party Ballots,2016-05-23,2016,jop
JOP,"Replication Data for ""News from the Other Side: How Topic Relevance Limits the Prevalence of Partisan Selective Exposure""",2016-05-19,2016,jop
JOP,"""Issue Divisions in U.S. Supreme Court Decision Making""",2016-05-16,2016,jop
JOP,Social Exclusion and Political Identity: The Case of Asian American Partisanship,2016-05-12,2016,jop
JOP,"Replication Data for ""Why Partisans Don't Sort: The Constraints on Partisan Segregation""",2016-05-02,2016,jop
JOP,"Replication Data for ""Social Patterns of Inequality, Partisan Competition, and Latin American Support for Redistribution""",2016-04-29,2016,jop
JOP,Political Homophily in Social Relationships,2016-04-29,2016,jop
JOP,How Different Forms of Health Matter to Political Participation,2016-04-25,2016,jop
JOP,Nonparametric Combination (NPC): A Framework for Testing Elaborate Theories,2016-04-19,2016,jop
JOP,"Theory, Data, and Deterrence: A Response to Kenwick, Vasquez, and Powers",2016-04-19,2016,jop
JOP,"""Can Citizens Discern? Information Credibility, Political Sophistication, and the Punishment of Corruption in Brazil""",2016-04-15,2016,jop
JOP,"""Careers, Connections, and Corruption Risks: Investigating the impact of bureaucratic meritocracy on public procurement processes.""",2016-04-12,2016,jop
JOP,The Charmed Life of Superstar Exporters: Survey Evidence on Firms and Trade Policy,2016-04-08,2016,jop
JOP,The Structure of American Income Tax Policy Preferences,2016-04-05,2016,jop
JOP,When Do Defensive Alliances Provoke rather than Deter?,2016-04-03,2016,jop
JOP,"Sharing the Risk? Households, labor market vulnerability and social policy preferences in Western Europe",2016-03-18,2016,jop
JOP,Interpreting Regression Discontinuity Designs with Multiple Cutoffs,2016-03-16,2016,jop
